<?xml version="1.0" encoding="UTF-8"?>
<field xmlns="http://www.w3.org/2001/XMLSchema" xmlns:xsi="http://www.w3.org/2001/XMLSchema-instance"
	xsi:schemaLocation="http://www.w3.org/2001/XMLSchema xsd.xsd">

<!-- Players use field hours -->
	<players>
		<player p_id="_4">
			<name>Meelis</name>
		</player>
		<player p_id="_5">
			<name>Andres</name>
		</player>
		<player p_id="_7">
			<name>Anne</name>
		</player>
	</players>
	<field_hours>
		<field_hour f_id="_12">
			<start>12:00:00</start>
			<end>13:00:00</end>
		</field_hour>
		<field_hour f_id="_15">
			<start>15:00:00</start>
			<end>16:00:00</end>
		</field_hour>
		<field_hour f_id="_18">
			<start>18:00:00</start>
			<end>19:00:00</end>
		</field_hour>
	</field_hours>
	<!-- Where can I see any existing players on field hours? -->
	<usage u_id="_1" f_id="_12" p_id="_1" />
	<usage u_id="_2" f_id="_15" p_id="_2" />
	<usage u_id="_3" f_id="_18" p_id="_3" />
</field>
